<?xml version='1.0' encoding='us-ascii'?>

<!-- DTD for describing an airline and its flights -->

<!-- An airline has a name and some number of flights -->
<!ELEMENT airline (name, flight*)>

<!ELEMENT name (#PCDATA)>

<!-- A flight has a number, a source, a departure time, a
     destination, an arrival time -->
<!ELEMENT flight (number, src, depart, dest, arrive)>

<!ELEMENT number (#PCDATA)>
<!ELEMENT src (#PCDATA)>
<!ELEMENT depart (date, time)>
<!ELEMENT dest (#PCDATA)>
<!ELEMENT arrive (date, time)>


<!-- A date has a month, day, and a year specified by Calendar.DATE,
     Calendar.MONTH, and Calendar.YEAR, respectfully. -->
<!ELEMENT date EMPTY>
<!ATTLIST date
          day    CDATA  #REQUIRED
          month  CDATA  #REQUIRED
          year   CDATA  #REQUIRED
>

<!-- A time has an hour, a minute, and at time zone.

     Hours are specified by ChronoField.HOUR_OF_DAY.

     Minutes are specified by ChronoField.MINUTE_OF_HOUR.

     The time zone is the name of the time zone such as "America/Los_Angeles"

-->
<!ELEMENT time EMPTY>
<!ATTLIST time
          hour       CDATA  #REQUIRED
          minute     CDATA  #REQUIRED
          time-zone  CDATA  #REQUIRED
>
